{
  "format": "ohc.catalog",
  "id": "urn:ohc:catalog:record-kinds",
  "version": "0.1.0",
  "specVersion": "0.1.0-draft",
  "title": {
    "en": "Stored record kinds",
    "ru": "Виды хранимых записей"
  },
  "description": {
    "en": "The 20 kinds of stored records (documents and embedded objects are not records). Used by grant selectors, steward scopes and `Tombstone.erasedKind`.",
    "ru": "20 видов хранимых записей (документы и встроенные объекты записями не являются). Используются в селекторах разрешений, полномочиях доверенных лиц и `Tombstone.erasedKind`."
  },
  "closed": true,
  "codes": [
    {
      "code": "Claim",
      "label": {
        "en": "Claim",
        "ru": "Утверждение"
      },
      "definition": {
        "en": "A statement about the person.",
        "ru": "Утверждение о человеке."
      }
    },
    {
      "code": "Relation",
      "label": {
        "en": "Relation",
        "ru": "Связь"
      },
      "definition": {
        "en": "A typed link between two records.",
        "ru": "Типизированная связь между двумя записями."
      }
    },
    {
      "code": "Source",
      "label": {
        "en": "Source",
        "ru": "Первичный источник"
      },
      "definition": {
        "en": "Metadata for one piece of primary material in the vault.",
        "ru": "Метаданные одного фрагмента первичного материала в хранилище."
      }
    },
    {
      "code": "Episode",
      "label": {
        "en": "Episode",
        "ru": "Эпизод"
      },
      "definition": {
        "en": "One occurrence in the person's life, told through dated accounts.",
        "ru": "Одно событие в жизни человека, рассказанное в датированных рассказах."
      }
    },
    {
      "code": "Interpretation",
      "label": {
        "en": "Interpretation",
        "ru": "Интерпретация"
      },
      "definition": {
        "en": "A reading of experience by a named author.",
        "ru": "Прочтение опыта названным автором."
      }
    },
    {
      "code": "Tension",
      "label": {
        "en": "Tension",
        "ru": "Напряжение"
      },
      "definition": {
        "en": "A conflict that matters, with who decides it.",
        "ru": "Значимый конфликт и тот, кто его решает."
      }
    },
    {
      "code": "Review",
      "label": {
        "en": "Review",
        "ru": "Решение по записи"
      },
      "definition": {
        "en": "An append-only status change.",
        "ru": "Изменение статуса, только добавляемое."
      }
    },
    {
      "code": "Proposal",
      "label": {
        "en": "Proposal",
        "ru": "Предложение"
      },
      "definition": {
        "en": "The intake record for content proposed by someone other than the person.",
        "ru": "Запись о поступлении содержания, предложенного не самим человеком."
      }
    },
    {
      "code": "Grant",
      "label": {
        "en": "Grant",
        "ru": "Разрешение"
      },
      "definition": {
        "en": "The person's permission, or denial, for one grantee.",
        "ru": "Разрешение человека (или запрет) для одного получателя."
      }
    },
    {
      "code": "Event",
      "label": {
        "en": "Event",
        "ru": "Событие журнала"
      },
      "definition": {
        "en": "An id-only log entry of writes and disclosures.",
        "ru": "Запись журнала о записях и раскрытиях, только с идентификаторами."
      }
    },
    {
      "code": "LensAdoption",
      "label": {
        "en": "Lens adoption",
        "ru": "Принятие линзы"
      },
      "definition": {
        "en": "The person's relation to one lens.",
        "ru": "Отношение человека к одной линзе."
      }
    },
    {
      "code": "AssessmentRecord",
      "label": {
        "en": "Assessment record",
        "ru": "Запись оценки"
      },
      "definition": {
        "en": "A dated result about the person within one lens.",
        "ru": "Датированный результат о человеке в рамках одной линзы."
      }
    },
    {
      "code": "ModelView",
      "label": {
        "en": "Model view",
        "ru": "Взгляд модели"
      },
      "definition": {
        "en": "One model's view over a set of episodes and evidence.",
        "ru": "Взгляд одной модели на набор эпизодов и свидетельств."
      }
    },
    {
      "code": "Practice",
      "label": {
        "en": "Practice",
        "ru": "Практика"
      },
      "definition": {
        "en": "A way of coping or acting.",
        "ru": "Способ справляться или действовать."
      }
    },
    {
      "code": "Outcome",
      "label": {
        "en": "Outcome",
        "ru": "Исход"
      },
      "definition": {
        "en": "What happened when something was tried or offered.",
        "ru": "Что произошло, когда что-то попробовали или предложили."
      }
    },
    {
      "code": "Pattern",
      "label": {
        "en": "Pattern",
        "ru": "Паттерн"
      },
      "definition": {
        "en": "A recurrence across at least two episodes (experimental).",
        "ru": "Повторение минимум в двух эпизодах (экспериментально)."
      }
    },
    {
      "code": "RecallCue",
      "label": {
        "en": "Recall cue",
        "ru": "Сигнал возвращения опыта"
      },
      "definition": {
        "en": "The person's permission to hand back their own experience in a described situation (experimental).",
        "ru": "Разрешение человека возвращать ему его собственный опыт в описанной ситуации (экспериментально)."
      }
    },
    {
      "code": "Part",
      "label": {
        "en": "Part",
        "ru": "Внутренняя часть"
      },
      "definition": {
        "en": "An inner position as the person names it (experimental).",
        "ru": "Внутренняя позиция так, как её называет человек (экспериментально)."
      }
    },
    {
      "code": "HealthRef",
      "label": {
        "en": "Health pointer",
        "ru": "Указатель на медицинскую запись"
      },
      "definition": {
        "en": "A pointer to a clinical record held elsewhere (experimental).",
        "ru": "Указатель на клиническую запись, хранящуюся в другом месте (экспериментально)."
      }
    },
    {
      "code": "Tombstone",
      "label": {
        "en": "Tombstone",
        "ru": "Метка удаления"
      },
      "definition": {
        "en": "A content-free placeholder for an erased record.",
        "ru": "Метка без содержания на месте удалённой записи."
      }
    }
  ]
}
